{
  "discriminator": "w020_advisory_receipt",
  "status": "generated",
  "request_id": "req_w020_001",
  "request_digest": "aaaaaaaaaaaaaaaaaaaaaaaaaaaaaaaaaaaaaaaaaaaaaaaaaaaaaaaaaaaaaaaa",
  "context": {
    "discriminator": "w020_role_safe_context",
    "actor_role": "student",
    "actor_id_hash": "bbbbbbbbbbbbbbbbbbbbbbbbbbbbbbbbbbbbbbbbbbbbbbbbbbbbbbbbbbbbbbbb",
    "tenant_id": "tenant_demo",
    "course_id": "course_001",
    "run_id": "run_001",
    "round_id": "round_001",
    "team_id": "team_001",
    "role_key": "CEO",
    "advisory_scopes": ["strategy"],
    "source_event_ids": ["event_001"],
    "source_event_types": ["section_saved"],
    "context_digest": "cccccccccccccccccccccccccccccccccccccccccccccccccccccccccccccccc",
    "transformation_version": "w020-role-safe-context-v1"
  },
  "coach_output": {
    "coach_output_id": "coach_output_001",
    "tenant_id": "tenant_demo",
    "run_id": "run_001",
    "round_id": "round_001",
    "team_id": "team_001",
    "role_key": "CEO",
    "output_type": "advisory",
    "advisory_only": true,
    "advisory_text": "Review the visible role scope.",
    "evidence_refs": ["event_001"],
    "created_at": "2026-08-09T00:00:00.000Z",
    "model_call_log_id": "model_call_001"
  },
  "model_call_log": {
    "model_call_log_id": "model_call_001",
    "tenant_id": "tenant_demo",
    "provider": "deterministic-mock",
    "model": "simwar-w020-deterministic-mock-v1",
    "purpose": "coach_advice",
    "status": "succeeded",
    "advisory_only": true,
    "input_hash": "dddddddddddddddddddddddddddddddddddddddddddddddddddddddddddddddd",
    "output_hash": "eeeeeeeeeeeeeeeeeeeeeeeeeeeeeeeeeeeeeeeeeeeeeeeeeeeeeeeeeeeeeeee",
    "prompt_tokens": 0,
    "completion_tokens": 8,
    "cost_usd": 0,
    "latency_ms": 0,
    "created_at": "2026-08-09T00:00:00.000Z"
  },
  "projection": {
    "advisory_only": true,
    "surface": "student_role",
    "title": "Role advisor",
    "recommendations": ["Review the visible role scope."],
    "evidence_refs": ["event_001"],
    "evidence_citations": [
      {
        "citation_id": "event:event_001",
        "label": "section_saved",
        "source_id": "event_001",
        "source_type": "workflow_event"
      }
    ],
    "policy": {
      "formal_truth_write": false,
      "human_final_authority": true,
      "pre_publish_student_exposure": false,
      "provider": "OFF"
    },
    "evaluation": {
      "checks": ["exact_context", "evidence_citation_present"],
      "fallback": "deterministic_rule",
      "status": "passed"
    },
    "known_limits": ["Human Validation not performed"]
  },
  "formal_truth_write": false,
  "known_limits": ["JSON_INTERNAL_ONLY"]
}
